Alexandria Ocasio-Cortez misrepresents ICE’s detention bed quota 		False		"ICE is required to fill 34,000 beds with detainees every single night and that number has only been increasing since 2009."
No, it's not correct that 39% of California students are undocumented		False		"39% of All California Students are illegals."
Viral image overstates births to undocumented mothers in California		False		"More than 66% of ALL births in California are to illegals on Medi-Cal."
Donald Trump off-base in describing GDP growth on his watch		False		"Watch those GDP numbers. We started off at a very low number, and right now we hit a 3.2 (percent). Nobody thought that was possible."
Donald Trump wrong that Mercedes, BMW import cars to U.S. by the millions		False		"The European Union … they send us Mercedes, they send us -- by the millions -- the BMWs -- cars by the millions."
Jeff Sessions' false claim that 80 percent of asylum applications are without merit		False		"Our courts find that 80 percent of those who do file for asylum aren’t qualified for it, do not merit that relief."
Ad falsely accuses Nevada's GOP governor candidate Laxalt of caving to drug makers		False		Says Republican gubernatorial candidate Adam Laxalt "tried to cut a deal with big pharma" in a lawsuit.
 		False		None
Ivanka Trump's Chinese proverb ahead of Singapore summit doesn't check out		False		A Chinese proverb says, "Those who say it can not be done, should not interrupt those doing it."
Donald Trump wrong about crime in Germany		False		"Crime in Germany is way up."
Dinesh D'Souza and Rosie O'Donnell FEC violations different		False		Says "Rosie O’Donnell apparently committed the same offense five times, five times, when she broke the identical law that Dinesh (D'Souza) was prosecuted for."
Kevin Cramer distorts Heidi Heitkamp's record on banking regulations		False		Says Heidi Heitkamp has "never been interested in" regulatory relief "until all of a sudden I become a candidate for the Senate and put pressure on."
Donald Trump falsely claims opioid numbers way down after $6 billion in new spending		False		"We got $6 billion for opioid and getting rid of that scourge that’s taking over our country. And the numbers are way down."
 		False		None
Donald Trump's false claim about 'thousands' of immigration judges		False		Speaking of immigration cases, says, "We have thousands of judges."
Donald Trump blames Democrats for own immigration policy separating families		False		A "horrible law" requires that children be separated from their parents "once they cross the Border into the U.S."
Donald Trump's false claim that Nancy Pelosi 'came out in favor of MS-13'		False		Says "Nancy Pelosi came out in favor of MS-13."
Did ex-intelligence chief Clapper say FBI spied on Trump campaign? No		False		Says James Clapper said "that the FBI was spying on (Trump's) campaign."
 		False		None
No links between Ritalin and school shootings, as NRA's Oliver North claimed		False		Perpetrators of school shootings "have been drugged in many cases … many of these young boys have been on Ritalin since they were in kindergarten."
Nancy Pelosi wrong on Medicaid's role for children, elderly		False		"Two-thirds of the people who use Medicaid are poor children, but two-thirds of the money is for long-term care for seniors, whether in a facility or at home."
Fact-checking Don Blankenship on Mitch McConnell and China		False		"Mitch McConnell was one of the few senators that voted after Tiananmen Square not to have punitive actions against China for human rights violations."
Donald Trump says wrongly the Iran nuclear deal expires in 7 years		False		"In seven years that (nuclear) deal will have expired, and Iran is free to go ahead and create nuclear weapons."
 		False		None
Are most of our taxes spent on the war on terror? No		False		"Most of our taxes are spent on the so-called ‘War on Terror.’"
Donald Trump gets ahead of the facts on North Korea denuclearization		False		Says North Korea has "agreed to denuclearization."
Do Republicans in Congress want to take away Social Security, Medicare, Medicaid?		False		"Republicans in Congress are plotting to take away Medicare, Medicaid and Social Security."
No, the Postal Service isn't losing a fortune on Amazon		False		"Only fools, or worse, are saying that our money losing Post Office makes money with Amazon. THEY LOSE A FORTUNE, and this will be changed."
Ryan Zinke wrong that Trump proposal would be biggest ever for public lands		False		A Trump administration proposal for the Interior Department "is the largest investment in our public lands infrastructure in our nation's history."
Donald Trump botches Japanese bowling ball on the car hood test		False		In Japan, "they take a bowling ball from 20 feet up in the air and they drop it on the hood of the car. And if the hood dents, then the car doesn't qualify...It's horrible, the way we're treated."
Donald Trump is wrong about wage trends		False		"When I was campaigning, I was talking about 18 and 20 years (when) wages effectively went down. Now, for the first time in a long time, they're starting to go up for people."
Are Democrats 'nowhere to be found on DACA,' as Donald Trump claimed?		False		"Democrats are nowhere to be found on DACA."
Donald Trump is wrong about the Pulse nightclub shooting		False		"You take Pulse nightclub. If you had one person in that room that could carry a gun and knew how to use it, it wouldn’t have happened, or certainly to the extent that it did."
 		False		None
Ryan Zinke wrong that gas prices are down 40% under Trump		False		"Under the previous administration it was … $100 to fill a car. American energy has delivered. Now it's $60. That’s $40 you have in your pocket … that you wouldn’t have."
Has President Donald Trump clearly and frequently spoken out against abuse of women? Not when asked		False		"The president has been very clear. All forms of abuse, all forms of battery against women are deplorable and disgusting. ... He’s said that multiple times in the past."
Heidi Heitkamp didn't high-five Chuck Schumer following abortion vote		False		"Heitkamp High-Fives Schumer After Voting Against 20-Week Abortion Ban."
Donald Trump leaves out the facts in claim about visa lottery		False		The immigration visa lottery "randomly hands out green cards without any regard for skill, merit, or the safety of American people."
Donald Trump wrong again that recent tax bill is biggest ever		False		"We enacted the biggest tax cuts and reforms in American history."
Donald Trump’s unsubstantiated claims about chain migration, NYC terror suspect		False		Says "22 to 24 people" came into the United States due to family connection with suspect in the October 2017 New York City terror attack.
Did Democrats vote to deport Dreamers?		False		Democratic lawmakers who voted in favor of short-term spending bills "just voted to deport Dreamers."
Did Fire and Fury author Michael Wolff have access to the White House?		False		"I authorized Zero access to White House (actually turned him down many times) for author of phony book! I never spoke to him for book."
Donald Trump says there's 'substantial evidence of voter fraud.' There isn't		False		There is "substantial evidence of voter fraud."
Donald Trump wrong about how long GOP held Alabama Senate seat		False		The Senate seat won in a special election by a Democrat had been "held for more than thirty years by Republicans."
Has Donald Trump signed more bills than anyone? No. (His count ranks last)		False		"We have signed more legislation than anybody. We broke the record of Harry Truman."
Ivanka Trump wrong that in April, 'vast majority' will be filing their taxes on a 'postcard'		False		In April, "the vast majority will be (filling out their taxes) on a single postcard."
Trump wrongly says end of mandate is 'essentially' Obamacare repeal		False		"We essentially repealed Obamacare because we got rid of the individual mandate ... and that was a primary source of funding of Obamacare."
 		False		None
Seating Alabama Sen.-elect Doug Jones - does a delay break Senate rules?		False		Says Sen. Mitch McConnell's delay in seating Alabama Sen.-elect Doug Jones "is a flagrant violation of Senate policy, which requires Jones assume office the instant one of them wins the election."
 		False		None
Bernie Sanders wrongly says Donald Trump never apologized for Access Hollywood tape		False		Says Donald Trump "has not apologized" for comments caught on tape by "Access Hollywood."
Donald Trump wrong that black homeownership rate is at a record high		False		"Black homeownership just hit the highest level it has ever been in the history of our country."
No, the GOP concealed carry bill does not block states from keeping guns out of schools		False		Says the concealed carry bill would allow residents of certain states to "travel to your community and walk right into a school zone with a loaded weapon, no matter what local laws say."
Donald Trump falsely claims Hillary Clinton lied to FBI		False		"Hillary Clinton lied many times to the FBI."
Will the GOP tax bill cost Donald Trump 'a fortune'? No		False		Says the tax bill "is going to cost me a fortune, this thing -- believe me. Believe me, this is not good for me."
If you pay no taxes, will you end up with more money under GOP tax plan?		False		"If you don't pay income taxes ... you'll have more money" under the Republican tax plan.
Moore's wife coins new anti-abortion term to attack his Democratic opponent		False		Says Doug Jones "is for full-term abortion."
 		False		None
Behind Steve Bannon's misrepresentation of Chuck Todd's comments on Roy Moore		False		Says Chuck Todd said the Roy Moore story "felt completely orchestrated."
No, the Washington Post Roy Moore reporter doesn't have a history of 'faking'		False		Says a Washington Post reporter who broke news on Judge Roy Moore story has a criminal history of "faking."
Dick Durbin wrong that GOP tax bill hasn't had independent vetting		False		The Republican tax bill is "not being scored by the Congressional Budget Office, as it is traditionally."
Will 'every American' get a tax cut from House GOP bill?		False		The Republican tax bill "lets every American keep more of what they earned."
Diversity visa applicants are vetted, despite contrary claim from White House press secretary		False		Says diversity visa immigrants are not vetted.
Did Patrick Morrisey once support abortion rights?		False		Says Patrick Morrisey "ran for Congress in NJ as pro-choice."
Does Roy Moore want to end Medicaid and Medicare, as his Democratic opponent claims?		False		Says Roy Moore "has advocated getting the federal government out of health care altogether, which means doing away with Medicaid, which means doing away with Medicare."
Donald Trump wrong that his tax plan is biggest cut ever		False		Says the GOP plan he supports is "the biggest tax cut in U.S. history."
Trump says insurers made fortune off Obamacare. They didn't.		False		Insurance companies "have made a fortune with Obamacare."
Fact-checking John Kelly on Frederica Wilson's 2015 speech		False		At a 2015 dedication of an FBI building in Florida, Rep. Frederica Wilson "stood up there ... and talked about how she was instrumental in getting the funding for that building, and how she took care of her constituents because she got the money, and she just called up President Obama, and on that phone call he gave the money -- the $20 million -- to build the building. And she sat down."
Is it ‘against the law’ for NFL players to kneel for the national anthem, as Roy Moore said? No		False		NFL players taking a knee during the national anthem is "against the law."
Once again, Trump overstates U.S. tax ranking		False		"We're the highest developed nation taxed in the world."
Donald Trump's misleading linkage between stock gains, debt reduction		False		The Obama administration "borrowed more than $10 trillion, right? And yet, we picked up $5.2 trillion just in the stock market. ... Maybe in a sense we’re reducing debt."
Is Sen. Bob Corker responsible for the Iran deal, as Donald Trump claims?		False		"Bob Corker gave us the Iran Deal."
NRA's Chris Cox falsely says Dianne Feinstein wanted to take 'all of your guns'		False		Says Sen. Dianne Feinstein said "if she had 51 votes in the Senate for 'Mr. and Ms. America, turn in all of your guns,' they would do it."
No, gun silencers wouldn't have worsened the Las Vegas shooting		False		"The crowd (in Las Vegas) fled at the sound of gunshots. Imagine the deaths if the shooter had a silencer ..."
Donald Trump's dubious claim that his tax plan won't benefit him		False		Says "No, I don't benefit, I don't benefit" from his tax proposal.
Donald Trump wrongly blames ‘hospitalized’ senator for GOP health care collapse		False		"We have one senator who’s a ‘yes’ vote ... but he’s in the hospital. And he’s a ‘yes’ vote. So we can’t do it by Friday. So we have the votes" to pass a health care bill. 
Did Roy Moore fight for pay raises for 'politicians' during a court shutdown? No		False		"Roy Moore fought for pay increases for politicians while courts had to shut down because of lack of funding."
Mike Pence erroneously credits Thomas Jefferson with small government quote		False		"Thomas Jefferson said, ‘Government that governs least governs best.’ "
Is there evidence of voter fraud in New Hampshire, as Kris Kobach said? Not really		False		"Facts have come to light that indicate that a pivotal, close election was likely changed through voter fraud on November 8, 2016: New Hampshire’s U.S. Senate Seat, and perhaps also New Hampshire’s four Electoral College votes in the presidential election."
Rep. Dave Brat claims DACA leads to chain migration of up to 4 million. That's False		False		"So the number on DACA is 800,000, but every one person can bring in their entire extended family once they reach a certain status. So it's 3 or 4 million, right?"
 		False		None
Donald Trump repeats false claim about illegal border crossings		False		"We stopped traffic coming through -- 78 percent."
Arpaio falsely ties conviction to Obama administration		False		Says his conviction is "a political witch hunt by holdovers in the Obama justice department."
Donald Trump wrongly says U.S. is a net energy exporter		False		"We have become an energy exporter for the first time ever just recently."
Trump's False claim that there weren't too many people protesting his Phoenix rally		False		"There aren't too many people outside protesting" his speech at the Phoenix Convention Center.
Donald Trump said wages 'haven’t gone up for a long time,' but that's wrong		False		Wages "haven’t gone up for a long time."
Fact-checking Donald Trump's misleading tweet about U.S. nuclear arsenal		False		"My first order as president was to renovate and modernize our nuclear arsenal. It is now far stronger and more powerful than ever before."
Are there over $4 trillion of untaxed corporate earnings offshore, as Donald Trump said?		False		Untaxed corporate earnings used to be "$2.5 trillion … I guess it’s $5 trillion now. Whatever it is, it’s a lot more. So we have anywhere from 4 (trillion) to 5 or even more trillions of dollars sitting offshore."
False: Trump's claim about illegal immigration under past administrations		False		"The border is down 78 percent. Under past administrations, the border didn’t go down -- it went up."
Is it a felony to leak a financial disclosure form, as Anthony Scaramucci said?		False		"In light of the leak of my financial disclosure info which is a felony I will be contacting @FBI and the @TheJusticeDept"
In Youngstown, Trump incorrectly says he has achieved historic increase in defense spending		False		"We've achieved a historic increase in defense spending to get our troops the support they so richly deserve."
Yes, Chuck Schumer, oil prices do sometimes fall		False		"When the price for oil goes up on the markets, it goes right up, but it never goes down."
Trump: In Watergate, FBI reported to DOJ as a courtesy		False		During the Nixon Watergate investigation, "out of courtesy, the FBI started reporting to the Department of Justice. But there was nothing official."
 		False		None
Trump’s False claim that his presidential approval rating is ‘not bad’		False		Says his job approval poll numbers are "not bad" relative to other presidents at this point in his presidency.
Mike Pence falsely blames Medicaid expansion for disability waiting list in Ohio		False		In Ohio, due to Medicaid expansion, "nearly 60,000 disabled citizens are stuck on waiting lists ... leaving them without the care they need for months or even years."
 		False		None
Did John Podesta deny CIA and FBI access to DNC server, as Donald Trump claims?		False		Says John Podesta "refused to give the DNC server to the FBI and the CIA. Disgraceful!"
Has Donald Trump never 'promoted or encouraged violence,' as Sarah Huckabee Sanders said?		False		"The president in no way, form or fashion has ever promoted or encouraged violence."
Trump falsely claims his administration has deported half of MS-13 gang members		False		"We're pretty much at the 50 percent mark" on deportations of MS-13 gang members.
Blogger falsely ties death of U.N. official to Clintons		False		"U.N. official John Ashe set to testify against the Clintons may not have died by accident."
Rick Perry wrongly downplays human role in climate change		False		"Most likely the primary control knob (for the earth’s temperature) is the ocean waters and this environment that we live in."
Donald Trump wrong on Paris accord, China and coal plants		False		"China will be allowed to build hundreds of additional coal plants. So we can’t build the plants, but they can, according to this (Paris) agreement."
Donald Trump's tweet misleads about London mayor's reaction to bridge, stabbing attacks		False		"At least 7 dead and 48 wounded in terror attack and Mayor of London says there is ‘no reason to be alarmed!’ "
Did Donald Trump's trip create or save 'millions' of jobs?		False		Deals struck on his first foreign trip as president made and saved "millions of jobs."
Did Obamacare premiums double in most states this year? No		False		"This year, a majority of states are seeing premiums and costs double" under Obamacare.
Would the Republican health care bill take away anyone’s Medicaid?		False		"Nobody on Medicaid" will have their benefits taken away.
Ivanka Trump's new book includes quote falsely (and frequently) attributed to John Quincy Adams		False		Says John Quincy Adams said, "If your actions inspire others to dream more, learn more, do more, and become more, you are a leader."
Trump’s false claim that 'Dems want billions to go to Insurance Companies to bail out donors'		False		"Dems want billions to go to Insurance Companies to bail out donors"
Has Trump ‘given more financial disclosure than anybody else?'		False		Says President Donald Trump "has given more financial disclosure than anybody else."
How do Donald Trump's first 100 days rate historically?		False		"No administration has accomplished more in the first 90 days."
Howard Dean's wrong tweet that the Constitution doesn't protect 'hate speech'		False		"Hate speech is not protected by the first amendment."
Trump falsely claims Obama policies to blame for growth of MS-13 gang in the U.S.		False		"The weak illegal immigration policies of the Obama Admin. allowed bad MS 13 gangs to form in cities across U.S. We are removing them fast!"
Bernie Sanders wrong that voter turnout hit 20-year low in 2016		False		"When Trump won, we had the lowest voter turnout in 20 years."
Donald Trump's Syria strike looks a lot like Barack Obama's plan, despite what Rubio, others say		False		The Obama administration’s 2013 Syria proposal "had no clear objective," while Trump’s Syria strike "had a clear strategic objective."
Tom Cotton: It's 'unusual' for White House officials like Susan Rice to make unmasking requests		False		"It is unusual" for a White House official like former National Security Adviser Susan Rice to make unmasking requests.
Rick Santorum garbles climate change comments by Obama's EPA chief		False		"The EPA director under Obama said the Clean Power Initiative would have no effect on man-made CO2 emissions. That's what she said. Go look it up."
Donald Trump flubs how unemployment is calculated		False		"When you look for a job, you can't find it and you give up. You are now considered statistically employed."
Discussing health care, Mike Pence is wrong about how car insurance works		False		Says President Donald Trump’s proposal to allow Americans to buy health insurance across state lines would make it the same as "the way you buy car insurance" today.
Sean Spicer’s False claim that Paul Manafort played a minor role in the Trump campaign		False		Says Paul Manafort "played a very limited role" in the Trump presidential campaign.
Trump's False tweet that NSA, FBI said 'Russia did not influence electoral process'		False		"The NSA and FBI tell Congress that Russia did not influence electoral process."
Fact-check: Donald Trump says Germany owes 'vast sums of money to NATO'		False		"Germany owes ... vast sums of money to NATO & the United States must be paid more for the powerful, and very expensive, defense it provides to Germany!"
Donald Trump says he learned Obama tapped his phones from the New York Times		False		Says "the New York Times wrote about" Barack Obama wiretapping Donald Trump during the election. 
Tom Price undercounts Obamacare impact on getting more Americans insured		False		"The number of individuals who actually got coverage through the exchange who didn't have coverage before, or who weren't eligible for Medicaid before is relatively small. So we've turned things upside down completely for 3 million, or 4 million, or 5 million individuals."
EPA head Scott Pruitt says carbon dioxide is not 'primary contributor' to global warming		False		Carbon dioxide is not "a primary contributor to the global warming that we see."
Why the White House defense of Trump wiretap accusation is misleading		False		"Everybody acts like President Trump is the one that came up with this idea. ... There are multiple news outlets that have reported" former President Barack Obama ordered wiretapping on Trump.
Claire McCaskill says she never met with Russian ambassador, past tweets say otherwise		False		"I’ve been on the Armed Services (Committee) for 10 years. No call or meeting w/ Russian ambassador. Ever."
No evidence that protesters are paid to disrupt Republican town hall meetings		False		Political activists are "being paid" to protest members of Congress.
Donald Trump in Florida laments 'what's happening last night in Sweden.' But nothing happened		False		"Look at what’s happening last night in Sweden. Sweden, who would believe this? Sweden. They took in large numbers. They’re having problems like they never thought possible."
Donald Trump wrongly says CNN cut off Bernie Sanders for calling network 'fake news'		False		"While on FAKE NEWS @CNN, Bernie Sanders was cut off for using the term fake news to describe the network. They said technical difficulties!"
Trump wrong on  Sen. Blumenthal's CNN interview and Vietnam		False		Says CNN’s Chris Cuomo "never asked" Sen. Richard Blumenthal about Blumenthal's misstatements on his own service in Vietnam.
Donald Trump wrong that murder rate is highest in 47 years		False		"The murder rate in our country is the highest it’s been in 47 years."
President Trump says 109 people were affected by travel ban. It's at least 60,000		False		Says "109 people out of hundreds of thousands of travelers" were affected by the immigration executive order.
Fact-checking Kellyanne Conway on the 'Bowling Green massacre'		False		"Two Iraqis came here to this country, were radicalized and they were the masterminds behind the Bowling Green massacre. … It didn't get covered"
Kellyanne Conway wrongly says this is longest the U.S. has gone without a Treasury secretary		False		"This is longest that the nation has gone without a secretary of the Treasury, at least in modern times. If it's not the longest, it's darn close to it."
Kellyanne Conway incorrect that worker remittances to Mexico are 'No. 1' income flow		False		"Here's the fact: The No. 1 source of income into Mexico are Mexicans working here and sending the money back."
No evidence for Trump claim that it was 'impossible' for Syrian Christians to enter U.S.		False		"If you were a Muslim, you could come in, if you were a Christian, it was impossible."
Sean Spicer wrongly uses Pew study to bolster claim that non-citizens vote in large numbers		False		"There's one (study) that came out of Pew in 2008 that showed 14 percent of people who voted were noncitizens."
Trump wrongly blames press for feud with intel community		False		"The media ... sort of made it sound like I had a feud with the intelligence community."
 		False		None
Education nominee Betsy DeVos says a Wyoming school might need guns to stop grizzly bears		False		"I would imagine that there's probably a gun in the school (in Wapiti, Wyo.) to protect from potential grizzlies."
Keith Ellison wrong that CBO can't analyze cost of Obamacare repeal		False		"House GOP rules package bars CBO from counting spikes in deficit spending spurred by an ACA repeal."
Trump wrong that Americans don't care about his tax returns		False		Americans don't "care at all" about Donald Trump's tax returns.
Donald Trump's Electoral College victory was not a 'massive landslide'		False		"We had a massive landslide victory, as you know, in the Electoral College."
Reince Priebus falsely claims no conclusive report whether Russia tried to influence election		False		"There's been no conclusive or specific report to say" Russia was trying to muddy the election.
