It's colder in the U.S. than on Mars, Twitterverse says		False		It’s warmer on Mars than it is in parts of the United States and Canada during the polar vortex.
Obama adviser Gene Sperling says administration offered 'no magic number' for health marketplace sign-ups		False		The Obama administration offered "no magic number" of people that needed to sign up for health care on the marketplaces.
Rep. Paul Ryan said bipartisan budget deal is the first in divided government since 1986		False		The Murray-Ryan deal "is the first divided-government budget agreement since 1986."
Marco Rubio endorsed Obamacare for his family, Charlie Crist says		False		Says Marco Rubio endorsed Obamacare for his own family.
Viral blog posts say Obama 'minions' are allowing corporations to sell off Great Lakes water		False		"By using a little-known loophole ... Obama minions are allowing Nestle Company to export precious fresh water out of Lake Michigan."
Corker said Congress dragged Obama "kicking and screaming" to put sanctions on Iran		False		"The administration was kicking and screaming all the way with these sanctions being put in place (on Iran)."
Obama's immigration heckler wrong on presidential powers, experts say		False		President Barack Obama has the "power to stop deportation for all undocumented immigrants in this country."
N.C. Gov. Pat McCrory says most Democrats in his state "agree" with voter ID, election law		False		"If you survey, most (North Carolina) Democrats also agree with our (election) laws and voter ID."
Nancy Pelosi: Health care law doesn't demand insurance companies cancel policies		False		"The (health care) law does not demand that all of these cancellations go out."
Sen. Ted Cruz says gun prosecutions down under Obama administration		False		"Under President (George W.) Bush, prosecution of gun crimes was 30 percent higher than it is under President Obama."
Ted Cruz says U.S. has averaged 0.9 percent growth over past four years		False		"In the last four years, our economy has grown on average 0.9 percent a year."
Conservative group says Mary Landrieu backs Obamacare even as it decreases full-time employment		False		Says "new mandates are already reducing full-time employment."
Congress, criminals, Scientologists and other groups are exempt from Obamacare, claims Facebook post		False		Congress, criminals, Scientologists and other groups are exempt from Obamacare.
Sean Hannity says health insurance premiums up 99 percent for men, 62 percent for women		False		"In 45 out of 50 states, on average men are seeing their premiums double, going up 99 percent. Women up 62 percent."
Fox News' Andrew Napolitiano says U.S. is still paying interest on World War I costs		False		"Woodrow Wilson borrowed $30 billion to fund World War I in 1917. That money has not been paid back. And we are still paying interest on it."
Marco Rubio says he never favored a government shutdown and voted to fully fund the government		False		"I never was in favor of shutting down the government. … (I) voted to fund the government fully."
Louie Gohmert says deficit ballooned from $160 billion to $1.6 trillion in just one year		False		"We went from $160 billion deficit spending in (President George W.) Bush's last year to $1.6 trillion the following year."
Rep. Mulvaney says Obama gave 1,100 special waivers to Obamacare to his friends		False		The "president has given 1,100 special waivers to his friends" for Obamacare.
DNC chair says Chris Christie cut equal pay for women, called it ‘senseless bureaucracy’		False		Chris Christie "cut equal pay for women, calling it 'senseless bureaucracy.' "
Barack Obama says "Democrats and Republicans" in the Senate "acted responsibly by voting to keep our government open”		False		"The United States Senate — Democrats and Republicans — (voted) to keep our government open."
Saxby Chambliss says Obamacare is biggest entitlement U.S. taxpayers have ever seen		False		With Obamacare, "we're fixing to get hit with the biggest entitlement program the American taxpayers have ever seen."
McConnell links Obama to war on coal		False		"The president’s own advisers have said there’s a war on coal."
Secretary of State John Kerry says as a senator he ‘opposed the president’s decision to go into Iraq’		False		Says he "opposed the president’s decision to go into Iraq" in 2003.
Alan Grayson said Russia said on the record that it would replace weapons U.S. destroys in airstrikes		False		In the event of a U.S. strike on Syria, "the Russians will replace the weapons immediately. They’ve said it on the record. They’ve suggested they might even replace it with better stuff."
Rep. Ted Yoho says chemical weapons have been used ‘probably 20 times’ since 1990		False		Chemical weapons have been used "probably 20 times" since the Persian Gulf War.
The 2010 DREAM Act had 'strong bipartisan support,' said Janet Napolitano		False		The 2010 DREAM Act failed despite "strong bipartisan support."
Moms Demand Action says 'Little Red Riding Hood' has been banned, but assault weapons haven't		False		The book Little Red Riding Hood is something "that’s been banned in America," but not assault weapons.
Super PAC criticizes Booker for low Newark graduation rate		False		"Three years after getting the $100 million (from Mark Zuckerberg), less than two-thirds of students in Cory Booker's Newark graduate."
Mitch McConnell tags Kentucky primary opponent as tax delinquent		False		Says Matt Bevin has repeatedly failed to pay his taxes.
Marco Rubio says union for IRS workers is 'begging' to be let out of Obamacare		False		"Even the employees’ union for the IRS -- the very people in charge of enforcing this law -- are begging to be let out from under this law."
Are 90 million Americans not working or not looking for work?		False		Ninety million Americans either aren’t working or aren’t looking for work.
House Speaker John Boehner says rushed farm bill was nearly the same as old one		False		None
"This is the same (farm) bill we voted on a few weeks ago, with the exception of one or two sentences."		False		None
 		False		None
Senate bill has immediate legalization but border security that's 'designed never to come into being,' says Cruz		False		None
The Senate immigration bill "has immediate legalization ... and the border security is sometime in the future, and just like in 1986, it's designed never to come into being."		False		None
Rep. Dana Rohrabacher says Sen. Marco Rubio’s claims differ in Spanish		False		None
On immigration reform, Marco Rubio "all along has been saying, 'We have to have border security first' " and then "he gets on Spanish TV, he ends up saying, 'No, no. That will never get in the way.' "		False		None
Rep. Mike Rogers says the IRS scandal "clearly showed some criminal behavior"		False		None
The IRS scandal "clearly showed some criminal behavior."		False		None
Jim Bridenstine: U.S. spends 30 times as much on climate change research as on weather forecasting		False		"This president spends 30 times as much money on global warming research as he does on weather forecasting and warning."
Rush Limbaugh says HHS Secretary Kathleen Sebelius was the "one person" to determine fate of 10-year-old lung patient Sarah Murnaghan		False		"One person, Kathleen Sebelius, was going to determine whether or not" 10-year-old lung patient Sarah Murnaghan would live or die.
IRS targeted liberal groups during Bush years, says Jim McDermott		False		None
"During the Bush administration, liberal groups were targeted" by the IRS, similar to recent targeting.		False		None
Democrats say Republicans ‘doctored emails’ about Benghazi, ‘trying to pass them off as real’		False		None
"Republicans actually doctored emails between administration officials about Benghazi. Then, they released them to the press, trying to pass them off as real."		False		None
Maryland group says fingerprinting gun purchasers has reduced gun crime rates in five states		False		None
A law that mandates fingerprinting for gun purchasers is "a requirement that's reduced gun crimes in the five states where it's the law."		False		None
Rand Paul  says Hillary Clinton was ‘asked repeatedly to provide security in Benghazi … including direct cables’		False		None
Says Hillary Clinton "was asked repeatedly to provide security in Benghazi on several occasions, including direct cables."		False		None
Michele Bachmann says IRS "will have the ability" to delay or deny health care		False		None
"The IRS will have the ability potentially" to deny or delay health care.		False		None
Barack Obama says review of Benghazi attack "investigated every element"		False		None
"Over the last several months, there was a review board headed by two distinguished Americans, Mike Mullen and Tom Pickering, who investigated every element of" the Benghazi incident.		False		None
Jay Carney says Susan Rice didn't play down terrorist involvement in Benghazi		False		None
When Susan Rice spoke about Benghazi on Sunday news shows, she said "that al-Qaida might be involved, or other al-Qaida affiliates might be involved, or non-al-Qaida Libyan extremists, which I think demonstrates that there was no effort to play that down."		False		None
Bloggers say Pentagon may court-martial Christian soldiers		False		None
"Pentagon confirms they may court martial soldiers who hold Christian faith."		False		None
Rep. Tom Cotton says more terrorists have 'reached their targets' under Barack Obama than under George W. Bush		False		None
"In barely four years in office, five jihadists have reached their targets in the United States under Barack Obama," compared to zero "in over seven years after 9/11 under George W. Bush."		False		None
Eric Cantor says FAA could cut funds to avoid furloughs		False		None
"Why is President Obama unnecessarily delaying your flight? FAA could cut other spending."		False		None
NRA says Manchin-Toomey would have criminalized some gun transfers between family, friends		False		The Manchin-Toomey amendment "would have criminalized certain private transfers of firearms between honest citizens, requiring lifelong friends, neighbors and some family members" to get government approval.
Rep. John Duncan Jr. says 90 percent of felons grew up in fatherless households		False		None
"Well over 90 percent of felony cases, all over the nation, are committed by defendants who grew up in father-absent households."		False		None
Rep. Ami Bera says due to sequester, 'people are going to be unsafe. Homes are going to burn'		False		None
Due to the sequester, "people are going to be unsafe. Homes are going to burn."		False		None
Arne Duncan says teachers are losing jobs because of sequestration		False		None
"There are literally teachers now who are getting pink slips" because of sequestration.		False		None
Kevin McCarthy says federal government has more revenue now than ‘any other time’		False		None
Says the federal government is earning more tax revenue now "than any other time."		False		None
Barack Obama says sequester could force prosecutors to 'let criminals go'		False		None
If the sequester hits, federal prosecutors will have to "let criminals go."		False		None
Wayne LaPierre says New York mayor refused National Guard help after Sandy  'because Guardsmen carry guns!'		False		None
Says after Hurricane Sandy, New York Mayor Michael Bloomberg "refused to allow the National Guard into the city to restore civil order because Guardsmen carry guns!"		False		None
Wayne LaPierre says Obama ignores border fence law		False		"The president flagrantly defies the 2006 federal law ordering the construction of a secure border fence along the entire Mexican border."
John Cornyn said move to delay Hagel nomination is “not a filibuster”		False		None
Says of a failed cloture vote on nominating Chuck Hagel for defense secretary: "This is not a filibuster."		False		None
Rush Limbaugh says immigrants come to U.S. seeking prosperity from government		False		Research shows that "a vast majority of arriving immigrants today come here because they believe that government is the source of prosperity, and that's what they support."
Chuck Hagel has called for 'an end to our nuclear program,' says Americans for a Strong Defense		False		None
Says Chuck Hagel has called for "an end to our nuclear program."		False		None
Bernie Sanders says poverty in U.S. is at an all-time high		False		None
"Poverty levels (are) at an all-time high."		False		None
Pro-Israel group's ad depicts Obama and Hagel disagreeing on Iran		False		None
"While President Obama says all options are on the table for preventing a nuclear Iran, Hagel says military action is not a viable, feasible, responsible option."		False		None
Ad claims Mitt Romney made 'over a hundred million dollars' shutting down paper plant		False		None
"Mitt Romney made over a hundred million dollars by shutting down (a Marion, Ind. paper) plant."		False		None
Radio ad says Mitt Romney wants to "get rid of Planned Parenthood”		False		None
Says Mitt Romney wants to "get rid of Planned Parenthood."		False		None
Barack Obama says Congress owns sequestration cuts		False		None
"The sequester is not something that I've proposed. It is something that Congress has proposed."		False		None
Mitt Romney says Barack Obama was silent about the protests after the 2009 Iran election		False		None
Says Barack Obama was silent on Iran "when the students took to the streets in Tehran and the people there protested, (and) the Green Revolution occurred."		False		None
Obama says Romney opposed any government help to rescue carmakers		False		None
Says Mitt Romney was clear that he "would not provide government assistance to the U.S. auto companies, even if they went through bankruptcy."		False		None
Ryan says six studies say the math works in Romney tax plan		False		None
Says six studies verify that the math adds up for Mitt Romney’s tax plan.		False		None
Obama ad says Romney raised nursing home fees eight times in Mass.		False		None
As governor, "Mitt Romney raised nursing home fees eight times."		False		None
Paul Ryan says the Obama administration ‘watered down sanctions’ against Iran		False		None
Says the Obama administration "watered down sanctions" against Iran, delayed them and tried to stop Congress "from putting the tough sanctions in place."		False		None
Barack Obama says economists' studies don't back up Mitt Romney's tax promises		False		None
Says economists Harvey Rosen and Martin Feldstein have said that "paying for (Mitt) Romney’s tax cuts would require large tax increases on families making between $100,000 and $200,000."		False		None
Paul Ryan says Biden sympathized and wouldn't second-guess forced abortions and sterilizations		False		None
Says Joe Biden "went to China and said that he sympathized and wouldn't second-guess their one-child policy of forced abortions and sterilizations."		False		None
Biden says 'we weren't told' about Libya security requests		False		None
"We weren't told they wanted more security " for diplomatic facilities in Libya.		False		None
Ryan says stimulus dollars paid for electric cars in Finland and windmills from China		False		None
Says the Obama administration spent taxpayer dollars on electric cars in Finland (and) windmills in China.		False		None
Ryan: Obama promised unemployment would not exceed 8 percent		False		None
Says Obama promised unemployment would never go above 8 percent.		False		None
Pro-Israel group attacks Rep. Lois Capps for casting only 'no' vote		False		None
"When Congress voted to condemn Iran for sentencing a Christian pastor to death, (U.S. Rep. Lois) Capps was the only member who voted no."		False		None
Super PAC says Romney takes from education, gives to millionaires		False		None
Says Romney wants to "take away early childhood education, slash K-12 funding, and cut college aid … to pay for a $250,000 tax break for multi-millionaires."		False		None
Obama ties Romney to Chinese exporter		False		None
Says Romney invested in a firm that made goods in China that "could have been made here in America."		False		None
Ad says Barack Obama promised the jobless rate would be 5.6% if Congress passed the stimulus		False		None
"This is what President Obama said the jobless rate would be if we passed the stimulus: 5.6 percent."		False		None
Ad says workforce smaller under Barack Obama than any time since Jimmy Carter		False		None
Under Barack Obama, the U.S. now has the "lowest workforce since (President Jimmy) Carter."		False		None
Obama says 50 million lose coverage if Obamacare is repealed		False		None
Says 50 million people would lose their health insurance if Obamacare is repealed.		False		None
Mitt Romney says his health care plan covers pre-existing conditions		False		None
"Pre-existing conditions are covered under my (health care) plan."		False		None
Romney says IPAB board can "tell people ultimately what treatments they're going to receive.”		False		None
Says Barack Obama "put in place a board that can tell people ultimately what treatments they're going to receive."		False		None
Paul Ryan says a dozen 'Obamacare' taxes hit middle-class Americans		False		None
Says President Barack Obama "already passed all these Obamacare taxes. About a dozen of them hit middle-income taxpayers."		False		None
Anti-tax group says Obama's stimulus led to jobs in China, not U.S.		False		None
The Obama administration’s "green" stimulus program "funneled close to $2 billion dollars to overseas firms," creating thousands of jobs in China.		False		None
Bill Clinton says TARP turned a profit		False		Says the government has "gotten the TARP money back plus a profit."
PAC ad says Obama will force Christian groups to pay for abortions		False		None
"Barack Hussein Obama will .. force Christian organizations to pay for abortions."		False		None
Mitt Romney, in Spanish-language ad, says college costs are up 25 percent under Barack Obama		False		None
College tuition "costs have risen by 25 percent under the Democrats."		False		None
Obama says Romney could take away middle class tax deductions		False		None
Says Romney tax plan "could take away middle-class deductions for child care, mortgages and college tuition."		False		None
Mitt Romney-aligned group says 'real' unemployment rate is 19 percent		False		None
"Eight million Americans have dropped out of the work force since (Barack) Obama became president. ... The real unemployment rate is 19 percent."		False		None
Romney repeats claim that Obama promised unemployment would not exceed 8 percent		False		None
Says President Obama promised "he'd keep unemployment below 8 percent" if the stimulus passed.		False		None
Romney claims five studies back up his tax plan		False		None
Says five studies show his tax plan can cut rates and still bring the same revenue without raising taxes on the middle class.		False		None
Mitt Romney ad blames Barack Obama for Florida housing woes		False		None
Under Obama, home values in Florida collapsed, construction jobs were lost and the state had a high foreclosure rate.		False		None
Barack Obama says, "We've doubled our use of renewable energy"		False		None
"We've doubled our use of renewable energy."		False		None
Rahm Emanuel says Romney asked for welfare work waiver in Massachusetts		False		Says Mitt Romney asked for a waiver from federal welfare rules.
Callista Gingrich says Barack Obama has “weakened the respect for America abroad”		False		None
President Barack Obama has "weakened the respect for America abroad."		False		None
Paul Ryan said President Obama “funneled” $716 billion out of Medicare “at the expense of the elderly.”		False		None
President Obama "funneled" $716 billion out of Medicare "at the expense of the elderly."		False		None
Artur Davis says the health care law requires people to buy insurance "whether they can afford it or not"		False		None
The health care law imposes a federal mandate requiring middle-class Americans to buy health insurance "whether they can afford it or not."		False		None
Group says Obama revealed secret information to Hollywood filmmakers		False		None
"Days after the (Osama bin Laden) raid, Hollywood was invited into the White House so that they could receive a briefing" that revealed intelligence sources and methods.		False		None
Mitt Romney said Barack Obama robs Medicare of more than $700 billion to pay for Obamacare 		False		None
Says Barack Obama "robbed Medicare (of) $716 billion to pay for ... Obamacare."		False		None
Mitt Romney says 90 percent of cities saw unemployment rise in June		False		None
"In June, jobless ranks were higher in nearly 90 percent of U.S. cities."		False		None
Do Olympic medalists owe up to $9,000 to the IRS?		False		"U.S. Olympic medal winners will owe up to $9,000 to the IRS."
Romney said Reagan sent troops into conflict only once		False		None
President Ronald Reagan sent troops into conflict "only in one circumstance, which was in Grenada … We were in a peacekeeping setting in Lebanon."		False		None
Calligraphers make more than national security directors in Obama White House, says Mike Huckabee		False		"The White House has three staff calligraphers making between $86,000 and $97,000 each, and just one National Security Director. She makes $55,000."
Ad says Mitt Romney had Olympic uniforms made in Burma		False		None
Says Romney had the uniforms for the 2002 Winter Olympic games made in Burma.		False		None
Stimulus went to windmills from China? Romney ad says so		False		None
Stimulus dollars paid for "windmills from China."		False		None
Barack Obama says Mitt Romney received carried interest, a tax 'trick'		False		None
Says Mitt Romney’s carried interest income was a tax "trick."		False		None
Ad says Obama apologized, showed weakness on Iran		False		None
"For his first interview as president, Barack Obama chose Arab TV for an apology."		False		None
Facebook post compares corporate, individual tax burden in 1950, today		False		None
"In 1950, corporations paid $3 in taxes for every $1 by a worker. Today, they pay 22 cents for every $1 by a worker."		False		None
Barack Obama ad says women are paid "77 cents on the dollar for doing the same work as men"		False		"Women (are) paid 77 cents on the dollar for doing the same work as men."
Facebook post says "less than 2 percent of illegals are picking crops, but 41 percent are on welfare"		False		None
"Less than 2 percent of illegals are picking crops, but 41 percent are on welfare."		False		None
Jim DeMint and other Republicans say Obama immigration plan is amnesty		False		None
Says President Obama's new immigration plan "is amnesty."		False		None
Facebook post compares elements of Romneycare, Obamacare		False		"Romneycare covers abortion, illegal immigrants and has a public option. Obamacare does not."
Democratic SuperPAC ad blasts Romney record on funding law enforcement		False		None
"As Governor: Romney did not keep public safety funding in line with inflation."		False		None
Gary Johnson tells Jon Stewart he has 8 percent support nationally		False		None
"Right now, I’m polling at about 8 percent" against Barack Obama and Mitt Romney.		False		None
Barack Obama's 'Life of Julia' says Mitt Romney would replace Medicare with ‘nothing but a voucher’		False		None
Says under Mitt Romney, "Medicare could end as we know it, leaving Julia with nothing but a voucher to buy insurance, which means $6,350 extra per year for a similar plan."		False		None
Donnelly says he didn’t vote for Pelosi for Speaker		False		None
Says he did not vote for Nancy Pelosi for speaker of the House.		False		None
Anti-abortion group says Obama White House screens unborn babies		False		None
The Obama White House recognizes a "baby that has not been born" for security purposes.		False		None
Ad says stimulus tax credits funded traffic lights in China		False		None
Says the stimulus bill sent tax credits overseas, such as  "tens of millions of dollars to build traffic lights in China."		False		None
Mitt Romney says Hispanic unemployment has risen under Barack Obama		False		None
"The total unemployment rate for Hispanic or Latino workers has increased from 10% to 10.3%" between January 2009 and March 2012.		False		None
 		False		None
Mitt Romney chart claims Barack Obama has 'the worst record on female labor force participation'		False		None
"What president has the worst record on female labor force participation? Barack Obama."		False		None
Romney campaign says women were hit hard by job losses under Obama		False		None
"Women account for 92.3 percent of the jobs lost under Obama."		False		None
Romney says Obama failed to pass a budget		False		None
Says Obama has failed to pass a budget.		False		None
Senate Republican web video attacks Barack Obama, saying he increased health care premiums		False		None
Says that while President Barack Obama promised to "work with your employer to lower your premiums by $2,500 per family per year," his health care law "raises premiums in the individual market by $2,100 per family."		False		None
Barack Obama film says health care law aided 17 million kids with pre-existing conditions		False		None
Because of the new health care law, "17 million kids can no longer be denied for a pre-existing condition."		False		None
Rick Santorum says happiness 'at the time of our founders' was 'doing what you ought to do'		False		None
"If you look up the dictionary definition of happiness at the time of our founders … happiness was not doing what you want to do but doing what you ought to do."		False		None
NRCC ad says 1,500 jobs lost daily since President Barack Obama took office		False		None
"Since President Obama took full control of Washington … every single day, more than 1,500 of our jobs have been lost."		False		None
Newt Gingrich says U.S. may have 'three times as much oil' as Saudi Arabia		False		One estimate says there may be "three times as much oil in the United States as there is in Saudi Arabia."
