Wrong numbers, off point		False		"I had prostate cancer, five, six years ago. My chance of surviving prostate cancer, and thank God I was cured of it, in the United States, 82%. My chances of surviving prostate cancer in England, only 44% under socialized medicine."
She has met with them four times		False		Clinton "refused repeated requests to meet with the Gold Star Mothers."
The Clintons don't receive money from Secret Service		False		"The Clintons now charge the Secret Service $10,000 monthly rent for the use of (a) Secret Service residence and that rent is just about equal to their mortgage payment."
McCain trips on word "everybody"		False		"Another one he should veto is the SCHIP program, which he should say 'Take the C out of, because now it's for everybody, like every other entitlement program.'"
Half-baked Alaska		False		"We spent $223-million on a bridge in Alaska to an island with 50 people on it."
Not the funding gap he claims		False		"Rural schools enroll 40 percent of American children, but receive only 22 percent of federal education funding."
The Iraq Study Group didn't say that		False		"The Iraq Study Group reported that (Saddam Hussein) had designs on reviving his nuclear program."
Edwards forgets Kucinich		False		"I was the first presidential candidate to lay out a specific, truly universal health care plan."
Biden way off on alcohol-related birth defects		False		"There are 300,000 babies born deformed every year in this country because of women who are alcoholics while they're carrying those children to term."
Pure hyperbole		False		"What they will do is socialized medicine."
A few exceptions to his small-government principles		False		"Dr. Paul never votes for legislation unless the proposed measure is expressly authorized by the Constitution."
Romney now opposes abortion		False		"I'm pro-life. He's not."
Little impact from making English 'official' 		False		English "is our national language...if it becomes official, that means in a place like New York City you can't print ballots in any other language."
Z-visas have many requirements		False		"The Z-visa that was offered in that Senate bill let everybody who's here illegally, other than criminals, stay here for the rest of their lives."
By itself, black voter increase does not flip Mississipi &mdash; or the South		False		If African-Americans vote their percentage of the population in 2008, "Mississippi is suddenly a Democratic state."
Sorry, New York is not that big		False		"The crime decline in the United States would be fairly small if it wasn't for the crime decline in New York City."
There are no atheist candidates.		False		"I'll tell you what I can tell this country: If they want a president who doesn't believe in God, there's probably plenty of choices."
Most scientists say humans cause warming		False		"For every single scientist that tells you (global warming is) happening and that it's our fault...I can stack up another group of reports that say just the opposite."
Trump campaign manager’s tweet omits that children detained under Obama were unaccompanied minors		False		"Fact: Over 90,000 kids were detained under Obama. And no one cared."
Corey Stewart's misleading comments on Sen. Tim Kaine and Antifa		False		Says Sen. Tim Kaine "approves of and even applauds his son's participation in a known terrorist organization, #Antifa."
Corey Stewart's history with the far right, explained		False		"I have always condemned … any of these white supremacists or bigots or anything like that."
No, Bill Clinton did not give North Korea $3 billion for nothing, as Donald Trump said		False		Says Bill Clinton "spent $3 billion and got nothing. And (North Korea) started making nuclear weapons a day later."
Was initial Trump statement on Trump Tower meeting accurate, as lawyers' memo said?		False		Say President Donald Trump "dictated a short but accurate response to the New York Times article" about the Trump Tower meeting with Russians.
Bill Clinton overplays debt following Monica Lewinsky affair		False		"I left the White House $16 million in debt."
Is your Amazon Alexa spying on you?		False		"Amazon Echo is recording every conversation in a person's home and transmitting it to the cloud."
Scott Dawson distorts Alabama Gov. Kay Ivey's grant funding to LGBTQ nonprofit		False		"Gov. Kay Ivey gave nearly $1 million of taxpayers’ money to a liberal activist organization that promotes alternative lifestyles and transgenderism."
Did Congress approve $1.6 billon for school safety?		False		A recent spending bill had at least "$1.6 billion in there ... for schools to give them an opportunity to secure them."
Senate Democrats flub stat on increase of gas prices this year		False		"El precio de combustible ha aumentado un 25% este año" / "The price of gas has increased 25% this year."
Mo Brooks' incomplete comments on Antarctic ice		False		"You’re going to have an increase in the amount of ice in Antarctica because of global warming."
Donald Trump exaggerates on number of MS-13 gang members deported		False		Says of MS-13 gang members, "We are getting them out of our country by the thousands."
Patrick Morrisey cherry-picks Joe Manchin's votes on Trump Supreme Court pick Neil Gorsuch		False		"If Joe Manchin had his way, Judge Gorsuch never would have been able to get a vote."
Rosen misleads on Heller Yucca Mountain vote		False		Says Dean Heller "has voted for a GOP bill that funded efforts to revive Yucca Mountain."
 		False		None
Donald Trump’s misleading claim that Kanye West’s praise doubled his African-American support		False		"I doubled my African-American poll numbers. We went from 11 to 22 in one week."
Don Blankenship claims illegal immigration costs $130 billion a year. Is that true?		False		Says illegal immigration is "costing us $130 billion a year to house and feed and give benefits to people that shouldn’t be even in the country."
No, California bill would not ban Bible sales		False		"California State Assembly bill would ban the (sale of the) Bible!"
 		False		None
Middle-class tax cuts as weapon in Nevada Senate race		False		Says Jacky Rosen promised "to repeal middle-class tax cut."
Chuck Schumer, Senate Democrats flub statistic on layoffs in 2018		False		In the wake of the Republican-backed tax bill, "more than 100,000 American workers have already been laid off in 2018."
Did Patrick Morrisey write a health care law for 'illegals'?		False		"In Congress, (Patrick) Morrisey wrote the health care law giving free health care to illegals."
Do women get only 80 percent of the pay men do for the same job?		False		"On average, American women only earn 80 cents for every dollar a man earns for doing the same job."
Did Luke Messer plot to steal the nomination from Donald Trump in 2016? Not really		False		"Luke Messer? He plotted with the Never-Trumpers to steal the nomination from President Trump."
Was Scott Pruitt's apartment rental about market rate?		False		EPA administrator Scott Pruitt's short-term rental "was about market rate."
Is Scott Pruitt's security spending somewhat more than predecessor? It's a lot more		False		Says Scott Pruitt’s security spending was "somewhat more" than his predecessor.
Can taxpayers expect card-sized tax forms next year, as Donald Trump says?		False		"This will be the last time — April — that you’re going to (fill out) that old-fashioned, big, lots of pages, complicated tax form. Because next April you’re going to, in many cases, (file) one page, one card. It’s going to be very, very different. Very, very different."
Donald Trump wrongly claims border wall is under construction		False		"We’ve started building the wall."
Donald Trump off-base in comparison of U.S., Mexico border laws		False		Mexico has "very strong border laws -- ours are pathetic."
Did the U.S. have a $500 billion deficit with China in 2017?		False		"Last year we lost $500 billion on trade with China."
Joe Manchin off-target on small business share of West Virginia's economy		False		Small businesses in West Virginia "make up about 96 percent of our state's economy."
Here's what's wrong about Donald Trump's attack on Canada trade deficit		False		"We do have a Trade Deficit with Canada, as we do with almost all countries (some of them massive)."
Did Obama cut $300 million for school safety? Not really		False		"The Obama administration had cut $300 million from school safety."
 		False		None
NRA's Loesch cherry-picks terrorism deaths in France to argue against assault weapon ban		False		In comparing mass shootings, "France had a higher casualty rate in one year than the entire two administrations of Barack Obama."
 		False		None
Fact-checking a misleading post on ID requirements for buying guns, voting		False		In most states, you can buy an assault rifle with no proof of ID, but in every state, you need proof of ID to vote.
Has Donald Trump 'been much tougher on Russia' than Barack Obama?		False		"I have been much tougher on Russia than Obama, just look at the facts. Total Fake News!"
Misleading NRSC ad paints Heidi Heitkamp as Donald Trump contrarian		False		"Heitkamp has voted against Trump 68 percent of time."
Donald Trump wrongly suggests British don't love their health care system		False		"The Democrats are pushing for Universal HealthCare while thousands of people are marching in the UK because their U system is going broke and not working."
No, Trump hasn't cut 22 regulations for every new one		False		"Instead of two for one, we have cut 22 burdensome regulations for everyone new rule."
Trump's State of the Union ratings are not the highest in history		False		"45.6 million people watched (the State of the Union), the highest number in history. @FoxNews beat every other Network, for the first time ever, with 11.7 million people tuning in."
Are college basketball graduation rates at an all-time high, as John Calipari said?		False		"We have the highest graduation rate of basketball players in the history of the NCAA. We have the highest graduation rate of African-American basketball players in the history of the NCAA in basketball."
Donald Trump's misleading claim about chain migration, unlimited sponsorship of distant relatives		False		"A single immigrant can bring in unlimited numbers of distant relatives."
Fact-checking Donald Trump's misleading claim about the release of 'dangerous terrorists'		False		"In the past, we have foolishly released hundreds and hundreds of dangerous terrorists, only to meet them again on the battlefield — including the ISIS leader, al-Baghdadi, who we captured, who we had, who we released."
Donald Trump exaggerates energy exports		False		"We are now, very proudly, an exporter of energy to the world."
 		False		None
Is U.S. 'finally seeing rising wages,' as Donald Trump said?		False		"After years of wage stagnation, we are finally seeing rising wages."
Mexico isn't the deadliest country in the world, as Trump said		False		Mexico is "now rated the number one most dangerous country in the world."
Was Evan Jenkins once Joe Manchin's spokesman?		False		Says Evan Jenkins was Sen. Joe Manchin’s "spokesperson. It’s true!"
Would the military shut down if the federal government does?		False		In a government shutdown, "what they are really doing is shutting down our military."
Trump wrongly faults Obama for London embassy move		False		Says the Obama administration "sold perhaps the best located and finest embassy in London ... only to build a new one in an off location for 1.2 billion dollars."
Did Obama say he didn't have the right to issue DACA?		False		When President Barack Obama "signed the executive order (on DACA, he) actually said he doesn't have the right to do this."
 		False		None
White House is misleading by citing only cuts, not hikes, in tax bill		False		The new tax law is "kicking the American economy into high gear with $5.5 trillion in tax cuts."
Have wages failed to go up on Donald Trump's watch?		False		"Even with full control of the House, Senate and White House, Republicans have still failed to deliver on their promise of higher wages for working families."
Doug Jones launches misleading attack ad about Roy Moore's court record on sex crime cases		False		"In a 2014 case involving a man convicted of abusing two underage girls, Judge Roy Moore disagreed and wrote the dissenting opinion."
 		False		None
Donald Trump wrongly claims Doug Jones wants to ‘raise taxes to the sky’		False		Says Alabama Senate candidate Doug Jones "wants to raise taxes."
Could Ted Cruz measure have prevented the Texas church shooting? Not likely.		False		"The Democrats filibustered the legislation that would’ve resulted in this shooter being in federal prison instead of murdering those innocents in that Texas church."
Alyssa Milano: no background checks in Texas for long gun sales. Is that true?		False		"There are no background checks on long guns (AR15s) in Texas."
Do Joe Manchin and Evan Jenkins support Clinton, cap-and-trade, Planned Parenthood and tax hikes?		False		Says Evan "Jenkins has the same positions on the issues as Joe Manchin: supporting Hillary (Clinton), supporting cap-and-trade, supporting Planned Parenthood, many tax increases."
Is diversity visa program a 'Schumer beauty,' as Donald Trump says?		False		Says the diversity visa lottery program is "a Chuck Schumer beauty."
No data to support claim that HIV/AIDS has spiked due to fentanyl and heroin use		False		Says HIV and AIDS rates have spiked "due to increased heroin and fentanyl use."
Trump wrongly says Manafort crimes came years before he joined the campaign		False		Says Paul Manafort’s alleged crimes were "years ago, before Paul Manafort was part of the Trump campaign."
Haley wrongly says Congress had no input on Iran nuclear deal		False		"And I think that his engagement with Congress is something that never happened under President Obama. They were never allowed to debate it. They were never allowed to discuss it. So, now Congress is going to be fully engaged on the threats of Iran."
Trump mislabels Obamacare subsidy as gift to insurers		False		"The cost-sharing reductions (were) a gift (that) they gave the insurance companies."
 		False		None
Is Oklahoma spending more than ever? Only if you ignore inflation		False		"State government spending is at an all-time high. The state is on track to spend more in this fiscal year — more than $17.9 billion — than at any time in state history."
 		False		None
Donald Trump omits facts in claim about loopholes, unaccompanied minors		False		"Loopholes in current law prevent ‘Unaccompanied Alien Children’ (UACs) that arrive in the country illegally from being removed."
Donald Trump says Luther Strange gained many points after endorsement, but evidence is weak		False		In the Alabama Senate runoff, "the candidate I endorsed (Luther Strange) went up MANY points after endorsement!"
Sen. Tom Cotton misleads in claim about Dream Act amnesty		False		"If you pass the so-called Dream Act, it will be the single biggest amnesty in the history of the United States, even bigger than the 1986 amnesty."
 		False		None
Trump's Mostly False claim that NFL ratings are 'way down'		False		"NFL attendance and ratings are WAY DOWN. Boring games yes, but many stay away because they love our country."
Trump's misleading claim on pre-existing protections in Graham-Cassidy		False		The Graham-Cassidy health care bill does "include coverage of pre-existing conditions."
Bill Cassidy offers misleading defense in face-off with Jimmy Kimmel		False		Under the Graham-Cassidy health insurance bill, in "states like Maine, Virginia, Florida, Missouri, there will be billions more dollars to provide health insurance coverage for those in those states who have been passed by by Obamacare."
GOP super PAC says Alabama's Roy Moore doesn't back Trump's border wall		False		Says Roy Moore is "on the wrong side of Trump’s border wall."
 		False		None
Jeff Sessions' questionable claim that DACA helped cause spike in minors at border		False		Says President Barack Obama’s policy known as DACA "contributed to a surge of minors at the southern border."
Ted Cruz's Mostly False claim that two-thirds of Sandy relief was pork spending		False		"Two-thirds of the (Hurricane Sandy relief) bill had nothing to do with Sandy."
No, Kelli Ward isn't a chemtrails conspiracy theorist		False		Says Kelli Ward hosted a town hall on "chemtrail conspiracy theories" and is open to sponsoring chemtrails legislation.
Donald Trump says 'business spirit' is highest it's ever been, but proof is lacking		False		"Business spirit is the highest it's ever been, according to polls."
In tweet, Donald Trump revives charge of improper ties between Hillary Clinton, acting FBI chief		False		"The person in charge of the Hillary investigation, Andrew McCabe, got $700,000 from (Hillary Clinton) for wife!"
Jeff Sessions cites study on sanctuary cities, researchers say he misrepresented it		False		"According to a recent study from the University of California Riverside, (sanctuary) cities with these policies have more violent crime on average than those that don’t."
 		False		None
Fact-check: White House's Conway uses conservative blog to claim media is hostile to Trump		False		Just 6 percent of Americans say Russia is the country’s most important issue, yet the story receives "75 percent of the coverage" in the media.
Trump claims he got rid of the Johnson Amendment. Is that true?		False		"I've gotten rid of the Johnson Amendment … I signed an executive order so that now ... ministers and and preachers and rabbis and whoever it may be, they can speak. You know, you couldn’t speak politically before, now you can."
 		False		None
Is Medicaid driving the budget deficit, as Pat Toomey said?		False		Medicaid "is contributing to 70 percent of our budget deficit right now. It’s the one that is in our lap because of Obamacare."
Is Donald Trump responsible for rising health insurance premiums, as Chris Murphy said?		False		Says because of Donald Trump, "the IRS decided to stop enforcing the individual mandate that was the underpinning of the ACA. That has resulted in insurance companies all across the country jacking their rates up, explicitly because they don't believe that healthy people will buy insurance."
Donald Trump says Barack Obama 'did nothing' about Russia prior to Election Day		False		Says Barack Obama found out about Russia "in August. Now, the election was in November. That's a lot of time. He did nothing about it."
Is Donald Trump right that gas prices are now lowest in over 10 years?		False		"Gas prices are the lowest in the U.S. in over ten years!"
Paul Ryan wrong that most of the 22 million uninsured would be uninsured by choice		False		Says the CBO said "it's not that people are getting pushed off a plan; it's that people will choose not to buy something they don't like or want."
 		False		None
Kellyanne Conway's Mostly False claim that GOP bill doesn't cut Medicaid		False		There "are not cuts to Medicaid" in the GOP health care proposals.
 		False		None
Trump wrongly calls Mueller's staffers Clinton supporters, employees		False		"I can say that the people that have been hired (for the independent Russia investigation) are all Hillary Clinton supporters, some of them worked for Hillary Clinton."
White House tweet wrongly says Obamacare led to fewer insurance options		False		Obamacare has led to fewer health insurance options for millions of Americans.
Donald Trump tweet on 50% approval cherry-picks polling data		False		"The new Rasmussen Poll, one of the most accurate in the 2016 Election, just out with a Trump 50% Approval Rating. That's higher than O's #'s!"
Donald Trump's Mostly False tweet about Obamacare dropouts		False		"Two million more people just dropped out of Obamacare. It is in a death spiral."
 		False		None
Donald Trump's boasts about accomplishments in office ring hollow		False		Rare is the president "who's passed more legislation, who's done more things than what we've done, between the executive orders and the job-killing regulations that have been terminated."
Are coal mining jobs up by 50,000 since last year? Not exactly		False		"Since the fourth quarter of last year until most recently, we've added almost 50,000 jobs in the coal sector. In the month of May alone, almost 7,000 jobs."
Al Gore says a majority of Trump voters support Paris Agreement. Really?		False		"A majority of President Trump's supporters and voters wanted (the United States) to stay in" the Paris Agreement.
Bernie Sanders inflates Trump tax plan benefits to billionaires		False		Says President Donald "Trump’s budget gives a $100 billion tax break to three of the wealthiest families."
Mostly False: Democrat says Paul Manafort visited Moscow during campaign		False		"You can see visits to Moscow made during the campaign by (Paul) Manafort and others."
Donald Trump’s Mostly False claim that James Clapper said no collusion found in Russia probe		False		Says James Clapper "and virtually everyone else" said "there is no collusion" in the Russia investigation findings.
Headlines that say GOP bill makes sexual assault a pre-existing condition are misleading		False		Under the House Republican health plan, sexual assault is a pre-existing condition.
Did trade deficit cause slow growth in 2016, as Donald Trump tweeted?		False		"The U.S. recorded its slowest economic growth in five years (2016). GDP up only 1.6%. Trade deficits hurt the economy very badly."
Ivanka Trump wrongly says child care single largest expense for half of households		False		"The single-largest expense in  over half of American households is child care."
 		False		None
Did terrorism not exist before NATO was created,  as Donald Trump said?		False		"Back when they did NATO, there was no such thing as terrorism."
Donald Trump's skewed portrayal of Obama's stimulus		False		"There was a very large infrastructure bill that was approved during the Obama administration, a trillion dollars. Nobody ever saw anything being built."
Jeff Sessions exaggerates claim about 'sanctuary' policies and violating federal law		False		"Just last May, the Department of Justice inspector general found that these (‘sanctuary city’) policies also violate federal law."
 		False		None
WH budget chief wrongly claims afterschool programs don't work		False		"There's no demonstrable evidence they (after-school programs that feed kids) are helping kids do better at school."
 		False		None
Mick Mulvaney's misleading claim that House GOP health care plan keeps Medicaid expansion		False		The House Republican health care "plan doesn't get rid of Medicaid expansion."
Are Americans gaming the system to get cheaper Obamacare coverage?		False		Under the Affordable Care Act, "some people were gaming the system" by paying "for nine months of insurance, get 12 -- the other three for free."
Donald Trump wrongly blames Barack Obama for former Guantanamo detainees returning to terrorism		False		"122 vicious prisoners, released by the Obama Administration from Gitmo, have returned to the battlefield."
Trump misleads in claim about terrorism convictions since 9/11		False		"According to data provided by the Department of Justice, the vast majority of individuals convicted of terrorism and terrorism-related offenses since 9/11 came here from outside of our country."
Trump wrongly claims historic defense increase		False		Says his budget "calls for one of the largest increases in national defense spending in American history."
Mostly False: New DNC chair Tom Perez says Donald Trump wants to eliminate overtime pay		False		Says "Donald Trump wants to eliminate overtime pay for people." 
Why Donald Trump's tweet about national debt decrease in his first month is highly misleading		False		"The National Debt in my first month went down by $12 billion."
Is news media less trusted than Congress?		False		The media has "a lower approval rate than Congress."
 		False		None
Did court find no indication of terrorism from seven nations in Trump order?		False		"I'm calling into question the accuracy of the ruling. The district judge in Seattle said there was no indication of terrorism from these seven countries in our country."
Donald Trump wrong to say Kuwait followed his lead on visa ban		False		"Smart! 'Kuwait issues its own Trump-esque visa ban for five Muslim-majority countries.' "
No proof ISIS leaders using Donald Trump's travel ban for recruitment		False		"ISIS is already using the rhetoric from the Trump administration, the text of this executive order, to incite attacks against us and to recruit more terrorists to their side."
Does Neil Gorsuch side with 'felons over gun safety,' as Pelosi says?		False		Says Neil Gorsuch "comes down on the side of felons over gun safety."
Nancy Pelosi overstates Wall Street refusal to support Democrats		False		"Wall Street comes out en masse with its money against House Democrats every election."
McCain says Taliban 'murdered' people because of Chelsea Manning and WikiLeaks		False		"The Taliban went after and murdered" people identified in the Chelsea Manning leaks. 
Spicer's misleading claim that Trump's National Security Council is 'identical' to Bush's, Obama's		False		The language that's part of the president's National Security Council memo "is identical to the language" used by President George W. Bush in 2001 and President Barack Obama in 2009.
Why comparing Trump's and Obama's immigration restrictions is flawed 		False		"My policy is similar to what President Obama did in 2011 when he banned visas for refugees from Iraq for six months."
Donald Trump was not 'unanimously endorsed' by ICE, border patrol		False		Says ICE and border patrol officers "unanimously endorsed me for president."
